{
  "schema_version": "v1",
  "manifest_id": "manifest.synthetic.0001",
  "ownership": {
    "organization_id": "org.synthetic.0001",
    "activity_id": "act.synthetic.0001",
    "participant_id": "part.synthetic.0001",
    "attempt_id": "att.synthetic.0001",
    "session_id": "sess.synthetic.0001"
  },
  "configuration_ref": {
    "configuration_id": "rsc.synthetic.0001",
    "configuration_digest": "aaaaaaaaaaaaaaaaaaaaaaaaaaaaaaaaaaaaaaaaaaaaaaaaaaaaaaaaaaaaaaaa"
  },
  "runtime_records": [
    {
      "sequence": 1,
      "record_type": "model.invocation.v1",
      "service_actor": "session-worker",
      "occurred_at": "2026-08-10T00:00:01Z",
      "payload_ref": {
        "protected_ref": "prot.synthetic.0001",
        "content_digest": "bbbbbbbbbbbbbbbbbbbbbbbbbbbbbbbbbbbbbbbbbbbbbbbbbbbbbbbbbbbbbbbb"
      }
    }
  ],
  "terminal_state": "active"
}
